{
  "schema_version": 1,
  "repo": "rahulnakmol/agentic-ayudha",
  "story": 709,
  "pr": 710,
  "pr_head_sha": "299524358e02afaffb4972337ae30a5398a32b64",
  "base_sha": "9b2f28cf8322a21cdc9e6b6fdc1a03da5fc99a8c",
  "seat": "ai-native-engineer",
  "host": "cli",
  "identity": "ci",
  "authority": {
    "kind": "authoritative",
    "workflow": ".github/workflows/aayudha-merge-gate.yml",
    "run_id": 39213400920,
    "writer": "rahulnakmol (aayu ship)"
  },
  "completion_goal_hash": "69770e1f081bca3a048fab92110d4ac8d841b295566ec3cf1b7b5baf0bd09665",
  "footprint": [
    "L02",
    "L03"
  ],
  "criteria": [
    {
      "id": 1,
      "evidence": [
        "evidence/criterion-1.jsonl"
      ]
    },
    {
      "id": 2,
      "evidence": [
        "evidence/criterion-2.jsonl"
      ]
    },
    {
      "id": 3,
      "evidence": [
        "evidence/criterion-3.jsonl"
      ]
    }
  ],
  "artifacts": [
    {
      "path": "coverage/diff.json",
      "kind": "metric",
      "sha256": "08cdb4dc9ef5b7aea8300891bf1aeb1e704f733ba2c7df6fabd3231c7f8a74d8",
      "size": 143,
      "store": "git"
    },
    {
      "path": "evidence/criterion-1.jsonl",
      "kind": "api-trace",
      "sha256": "6e2eb8b9da378363511f74248b07bd195acdabb427402b7c2d40e904df0f1d7e",
      "size": 621,
      "store": "git"
    },
    {
      "path": "evidence/criterion-2.jsonl",
      "kind": "api-trace",
      "sha256": "6e2eb8b9da378363511f74248b07bd195acdabb427402b7c2d40e904df0f1d7e",
      "size": 621,
      "store": "git"
    },
    {
      "path": "evidence/criterion-3.jsonl",
      "kind": "api-trace",
      "sha256": "6e2eb8b9da378363511f74248b07bd195acdabb427402b7c2d40e904df0f1d7e",
      "size": 621,
      "store": "git"
    },
    {
      "path": "reports/feature-map.json",
      "kind": "report",
      "sha256": "18beedca83d4e8a195de84f6e21a3823833a809fe86f85bbd12f692ffc00856e",
      "size": 1035,
      "store": "git"
    },
    {
      "path": "reports/gitleaks.json",
      "kind": "report",
      "sha256": "37517e5f3dc66819f61f5a7bb8ace1921282415f10551d2defa5c3eb0985b570",
      "size": 3,
      "store": "git"
    },
    {
      "path": "reports/osv-scanner.json",
      "kind": "report",
      "sha256": "f5aad51596612fdc0d352296c3c0e561d182b49d0aff1680c1e738bb9ab3baf2",
      "size": 10541,
      "store": "git"
    },
    {
      "path": "reports/semgrep.json",
      "kind": "report",
      "sha256": "9890d0c34d426ea88c6cc6cb2d1c8d86ba4f247e134c2a2e5890d55a1db78202",
      "size": 51434,
      "store": "git"
    }
  ],
  "checks": [
    {
      "floor": "coverage",
      "result": "pass",
      "value": 100,
      "threshold": 90,
      "tool": "aayudha diff coverage (go test -coverprofile)",
      "version": "go1.25.14",
      "detail": "49 of 49 changed executable lines covered (go coverprofile)",
      "network": "isolated"
    },
    {
      "floor": "sast",
      "result": "pass",
      "value": 0,
      "threshold": 0,
      "tool": "semgrep",
      "version": "1.180.0",
      "detail": "p/golang p/javascript p/typescript p/python p/kotlin p/ruby p/php p/swift p/github-actions: 0 critical, 0 high, 3 medium, 0 low",
      "network": "allowed"
    },
    {
      "floor": "secrets",
      "result": "pass",
      "value": 0,
      "threshold": 0,
      "tool": "gitleaks",
      "version": "8.30.1",
      "detail": "0 findings",
      "network": "isolated"
    },
    {
      "floor": "deps",
      "result": "pass",
      "value": 0,
      "threshold": 0,
      "tool": "osv-scanner",
      "version": "2.6.0",
      "detail": "go.mod pnpm-lock.yaml: 0 critical, 0 high, 0 medium, 0 low (3 more not called, by osv-scanner's call analysis)",
      "network": "allowed"
    },
    {
      "floor": "a11y",
      "result": "skipped",
      "value": 0,
      "threshold": 0,
      "tool": "aayudha",
      "version": "-",
      "detail": "skipped: no screenshot or recording criteria"
    },
    {
      "floor": "perf",
      "result": "skipped",
      "value": 0,
      "threshold": 0,
      "tool": "aayudha",
      "version": "-",
      "detail": "skipped: no screenshot or recording criteria"
    },
    {
      "floor": "screen-reader",
      "result": "skipped",
      "value": 0,
      "threshold": 0,
      "tool": "aayudha",
      "version": "-",
      "detail": "skipped: no-L01"
    },
    {
      "floor": "dast",
      "result": "skipped",
      "value": 0,
      "threshold": 0,
      "tool": "aayudha",
      "version": "-",
      "detail": "skipped: [verify] dast is off"
    },
    {
      "floor": "api",
      "result": "skipped",
      "value": 0,
      "threshold": 0,
      "tool": "aayudha",
      "version": "-",
      "detail": "skipped: no k6 script ([verify.floors.api] script)"
    },
    {
      "floor": "mobile",
      "result": "skipped",
      "value": 0,
      "threshold": 0,
      "tool": "aayudha",
      "version": "-",
      "detail": "skipped: no ios or android in [verify] platforms"
    },
    {
      "floor": "feature-map",
      "result": "pass",
      "value": 0,
      "threshold": 0,
      "tool": "aayudha feature map",
      "version": "1",
      "detail": "in sync; 1 feature changed since verified_at"
    },
    {
      "floor": "behaviour",
      "result": "skipped",
      "value": 0,
      "threshold": 0,
      "tool": "aayudha",
      "version": "-",
      "detail": "skipped: no behaviour check for this change (it touches no mapped feature, and no criterion maps a check)"
    },
    {
      "floor": "parity",
      "result": "skipped",
      "value": 0,
      "threshold": 0,
      "tool": "aayudha",
      "version": "-",
      "detail": "skipped: no criterion runs `aayu survey --parity` or `--compat`"
    },
    {
      "floor": "red-on-base",
      "result": "pass",
      "value": 3,
      "threshold": 3,
      "tool": "aayudha red-on-base (go test -json on the base)",
      "version": "1",
      "detail": "criterion 1: red on base; criterion 2: red on base; criterion 3: red on base (base 9b2f28c)"
    }
  ],
  "cost": {
    "tokens_in": 0,
    "tokens_out": 0,
    "usd": 0
  },
  "links": {
    "issue": "rahulnakmol/agentic-ayudha#709",
    "pr": "rahulnakmol/agentic-ayudha#710",
    "ready_snapshot": "specs/709/ready.md"
  },
  "created_at": "2026-10-19T07:13:36Z"
}
