{
  "schema_version": 1,
  "repo": "rahulnakmol/agentic-ayudha",
  "story": 995,
  "pr": 1024,
  "pr_head_sha": "f5052d27fcca596bb4d991ed6e0b770bd467a13e",
  "base_sha": "118408f29d80339056f91623802df735a71e3ef9",
  "seat": "ai-native-engineer",
  "host": "cli",
  "model": "claude-opus-5-5",
  "identity": "ci",
  "authority": {
    "kind": "authoritative",
    "workflow": ".github/workflows/aayudha-merge-gate.yml",
    "run_id": 40292062260,
    "writer": "rahulnakmol (aayu proof land)"
  },
  "completion_goal_hash": "63730f1ee9f19d0a22596f6543c8780d9f44448ab7b49faa7ee3218db02cbea0",
  "footprint": [
    "L02",
    "L03",
    "L04",
    "L07"
  ],
  "criteria": [
    {
      "id": 1,
      "evidence": [
        "evidence/criterion-1.jsonl"
      ]
    },
    {
      "id": 2,
      "evidence": [
        "evidence/criterion-2.jsonl"
      ]
    },
    {
      "id": 3,
      "evidence": [
        "evidence/criterion-3.jsonl"
      ]
    },
    {
      "id": 4,
      "evidence": [
        "evidence/criterion-4.jsonl"
      ]
    },
    {
      "id": 5,
      "evidence": [
        "evidence/criterion-5.jsonl"
      ]
    },
    {
      "id": 6,
      "evidence": [
        "evidence/criterion-6.jsonl"
      ]
    },
    {
      "id": 7,
      "evidence": [
        "evidence/criterion-7.jsonl"
      ]
    }
  ],
  "artifacts": [
    {
      "path": "coverage/diff.json",
      "kind": "metric",
      "sha256": "9ab795e6e6041825bacf3921bc70f20abe80472becca158cca968418a65f8465",
      "size": 622,
      "store": "git"
    },
    {
      "path": "evidence/criterion-1.jsonl",
      "kind": "api-trace",
      "sha256": "882b5dbfa889157284e236a3297bd058d9483eb3a8fa0ea78030b4876a17489d",
      "size": 561,
      "store": "git"
    },
    {
      "path": "evidence/criterion-2.jsonl",
      "kind": "api-trace",
      "sha256": "882b5dbfa889157284e236a3297bd058d9483eb3a8fa0ea78030b4876a17489d",
      "size": 561,
      "store": "git"
    },
    {
      "path": "evidence/criterion-3.jsonl",
      "kind": "api-trace",
      "sha256": "882b5dbfa889157284e236a3297bd058d9483eb3a8fa0ea78030b4876a17489d",
      "size": 561,
      "store": "git"
    },
    {
      "path": "evidence/criterion-4.jsonl",
      "kind": "api-trace",
      "sha256": "882b5dbfa889157284e236a3297bd058d9483eb3a8fa0ea78030b4876a17489d",
      "size": 561,
      "store": "git"
    },
    {
      "path": "evidence/criterion-5.jsonl",
      "kind": "api-trace",
      "sha256": "882b5dbfa889157284e236a3297bd058d9483eb3a8fa0ea78030b4876a17489d",
      "size": 561,
      "store": "git"
    },
    {
      "path": "evidence/criterion-6.jsonl",
      "kind": "api-trace",
      "sha256": "882b5dbfa889157284e236a3297bd058d9483eb3a8fa0ea78030b4876a17489d",
      "size": 561,
      "store": "git"
    },
    {
      "path": "evidence/criterion-7.jsonl",
      "kind": "api-trace",
      "sha256": "882b5dbfa889157284e236a3297bd058d9483eb3a8fa0ea78030b4876a17489d",
      "size": 561,
      "store": "git"
    },
    {
      "path": "reports/feature-map.json",
      "kind": "report",
      "sha256": "b01f29e5e24b032bb017f144283baaa0d794fb5989e49463fc2992d367109dd0",
      "size": 1014,
      "store": "git"
    },
    {
      "path": "reports/gitleaks.json",
      "kind": "report",
      "sha256": "37517e5f3dc66819f61f5a7bb8ace1921282415f10551d2defa5c3eb0985b570",
      "size": 3,
      "store": "git"
    },
    {
      "path": "reports/osv-scanner.json",
      "kind": "report",
      "sha256": "f5aad51596612fdc0d352296c3c0e561d182b49d0aff1680c1e738bb9ab3baf2",
      "size": 10541,
      "store": "git"
    },
    {
      "path": "reports/semgrep.json",
      "kind": "report",
      "sha256": "a355fa7b2e5badaec2fe40e732b000f40c068730031de721ed63d30dbced8d01",
      "size": 52852,
      "store": "git"
    },
    {
      "path": "reports/zap.json",
      "kind": "report",
      "sha256": "24e20956cff97bf7a3c209936a0edd22f164f3c4d4eb2e97c2ead91f4d8585ad",
      "size": 8856,
      "store": "git"
    }
  ],
  "checks": [
    {
      "floor": "coverage",
      "result": "pass",
      "value": 90,
      "threshold": 90,
      "tool": "aayudha diff coverage (go test -coverprofile)",
      "version": "go1.25.14",
      "detail": "318 of 353 changed executable lines covered (go coverprofile)",
      "network": "isolated"
    },
    {
      "floor": "sast",
      "result": "pass",
      "value": 0,
      "threshold": 0,
      "tool": "semgrep",
      "version": "1.180.0",
      "detail": "p/golang p/javascript p/typescript p/python p/kotlin p/ruby p/php p/swift p/github-actions: 0 critical, 0 high, 3 medium, 0 low",
      "network": "allowed"
    },
    {
      "floor": "secrets",
      "result": "pass",
      "value": 0,
      "threshold": 0,
      "tool": "gitleaks",
      "version": "8.30.1",
      "detail": "0 findings",
      "network": "isolated"
    },
    {
      "floor": "deps",
      "result": "pass",
      "value": 0,
      "threshold": 0,
      "tool": "osv-scanner",
      "version": "2.6.0",
      "detail": "go.mod pnpm-lock.yaml: 0 critical, 0 high, 0 medium, 0 low (3 more not called, by osv-scanner's call analysis)",
      "network": "allowed"
    },
    {
      "floor": "a11y",
      "result": "skipped",
      "value": 0,
      "threshold": 0,
      "tool": "aayudha",
      "version": "-",
      "detail": "skipped: no screenshot or recording criteria"
    },
    {
      "floor": "perf",
      "result": "skipped",
      "value": 0,
      "threshold": 0,
      "tool": "aayudha",
      "version": "-",
      "detail": "skipped: no screenshot or recording criteria"
    },
    {
      "floor": "screen-reader",
      "result": "skipped",
      "value": 0,
      "threshold": 0,
      "tool": "aayudha",
      "version": "-",
      "detail": "skipped: no-L01"
    },
    {
      "floor": "dast",
      "result": "pass",
      "value": 0,
      "threshold": 0,
      "tool": "zap",
      "version": "2.17.0",
      "detail": "active scan (rules 40012, 40014, 40018, 90020) of the app verify started under docker: 0 critical, 0 high, 0 medium, 3 low",
      "network": "allowed"
    },
    {
      "floor": "api",
      "result": "skipped",
      "value": 0,
      "threshold": 0,
      "tool": "aayudha",
      "version": "-",
      "detail": "skipped: no k6 script ([verify.floors.api] script)"
    },
    {
      "floor": "mobile",
      "result": "skipped",
      "value": 0,
      "threshold": 0,
      "tool": "aayudha",
      "version": "-",
      "detail": "skipped: no ios or android in [verify] platforms"
    },
    {
      "floor": "feature-map",
      "result": "pass",
      "value": 0,
      "threshold": 0,
      "tool": "aayudha feature map",
      "version": "1",
      "detail": "in sync with the source"
    },
    {
      "floor": "behaviour",
      "result": "skipped",
      "value": 0,
      "threshold": 0,
      "tool": "aayudha",
      "version": "-",
      "detail": "skipped: no behaviour check for this change (it touches no mapped feature, and no criterion maps a check)"
    },
    {
      "floor": "parity",
      "result": "skipped",
      "value": 0,
      "threshold": 0,
      "tool": "aayudha",
      "version": "-",
      "detail": "skipped: no criterion runs `aayu survey --parity` or `--compat`"
    }
  ],
  "cost": {
    "tokens_in": 0,
    "tokens_out": 0,
    "usd": 0
  },
  "links": {
    "issue": "rahulnakmol/agentic-ayudha#995",
    "pr": "rahulnakmol/agentic-ayudha#1024",
    "ready_snapshot": "specs/995/ready.md"
  },
  "created_at": "2026-10-26T08:35:26Z"
}
