{
  "schema_version": 1,
  "repo": "rahulnakmol/agentic-ayudha",
  "story": 173,
  "pr": 179,
  "pr_head_sha": "0b5800f5258fb74b5534bf47e15cbfb4ec80b435",
  "base_sha": "a82516e4f7d9cc28c0eda5e244a937a32bc4e38d",
  "seat": "ai-native-engineer",
  "host": "cli",
  "identity": "ci",
  "authority": {
    "kind": "authoritative",
    "workflow": ".github/workflows/aayudha-merge-gate.yml",
    "run_id": 38698143184,
    "writer": "rahulnakmol (aayu ship)"
  },
  "completion_goal_hash": "3371a0c58c191b4367ce5f83da9c4f6ed13d516fcafd430e455059a2475a5102",
  "footprint": [
    "L02",
    "L09"
  ],
  "criteria": [
    {
      "id": 1,
      "evidence": [
        "evidence/criterion-1.jsonl"
      ]
    },
    {
      "id": 2,
      "evidence": [
        "evidence/criterion-2.jsonl"
      ]
    },
    {
      "id": 3,
      "evidence": [
        "evidence/criterion-3.jsonl"
      ]
    }
  ],
  "artifacts": [
    {
      "path": "coverage/diff.json",
      "kind": "metric",
      "sha256": "36a0112eb16945adefe22713e3e9d0cd8ac56a911aeaeb80c3169e5e1ae2bd16",
      "size": 141,
      "store": "git"
    },
    {
      "path": "evidence/criterion-1.jsonl",
      "kind": "api-trace",
      "sha256": "dc23a62c91977d51fd61f0338d04e49b51f7c6def174f79def0354536458c794",
      "size": 605,
      "store": "git"
    },
    {
      "path": "evidence/criterion-2.jsonl",
      "kind": "api-trace",
      "sha256": "3ce5e783a4bdd60b962b7ded7bce1bf3d73756178e3ba78b49c1907793165fc1",
      "size": 1108,
      "store": "git"
    },
    {
      "path": "evidence/criterion-3.jsonl",
      "kind": "api-trace",
      "sha256": "a9fe3b71c91962a15139f108fca3abb982c1cb5ec2299a59f93d36681c9bee67",
      "size": 503,
      "store": "git"
    },
    {
      "path": "reports/gitleaks.json",
      "kind": "report",
      "sha256": "37517e5f3dc66819f61f5a7bb8ace1921282415f10551d2defa5c3eb0985b570",
      "size": 3,
      "store": "git"
    },
    {
      "path": "reports/osv-scanner.json",
      "kind": "report",
      "sha256": "f5aad51596612fdc0d352296c3c0e561d182b49d0aff1680c1e738bb9ab3baf2",
      "size": 10541,
      "store": "git"
    },
    {
      "path": "reports/semgrep.json",
      "kind": "report",
      "sha256": "32bd53801915aa1721cb4f8834cdceaf26342a957b60cdc398128921f05ef204",
      "size": 33838,
      "store": "git"
    }
  ],
  "checks": [
    {
      "floor": "coverage",
      "result": "pass",
      "value": 100,
      "threshold": 90,
      "tool": "aayudha diff coverage (go test -coverprofile)",
      "version": "go1.25.14",
      "detail": "0 of 0 changed executable lines covered (go coverprofile)",
      "network": "isolated"
    },
    {
      "floor": "sast",
      "result": "pass",
      "value": 0,
      "threshold": 0,
      "tool": "semgrep",
      "version": "1.180.0",
      "detail": "p/golang p/javascript p/typescript p/kotlin p/swift p/github-actions: 0 critical, 0 high, 0 medium, 0 low",
      "network": "allowed"
    },
    {
      "floor": "secrets",
      "result": "pass",
      "value": 0,
      "threshold": 0,
      "tool": "gitleaks",
      "version": "8.30.1",
      "detail": "0 findings",
      "network": "isolated"
    },
    {
      "floor": "deps",
      "result": "pass",
      "value": 0,
      "threshold": 0,
      "tool": "osv-scanner",
      "version": "2.6.0",
      "detail": "go.mod pnpm-lock.yaml: 0 critical, 0 high, 0 medium, 0 low (3 more not called, by osv-scanner's call analysis)",
      "network": "allowed"
    },
    {
      "floor": "a11y",
      "result": "skipped",
      "value": 0,
      "threshold": 0,
      "tool": "aayudha",
      "version": "-",
      "detail": "skipped: no screenshot or recording criteria"
    },
    {
      "floor": "perf",
      "result": "skipped",
      "value": 0,
      "threshold": 0,
      "tool": "aayudha",
      "version": "-",
      "detail": "skipped: no screenshot or recording criteria"
    },
    {
      "floor": "screen-reader",
      "result": "skipped",
      "value": 0,
      "threshold": 0,
      "tool": "aayudha",
      "version": "-",
      "detail": "skipped: no-L01"
    },
    {
      "floor": "dast",
      "result": "skipped",
      "value": 0,
      "threshold": 0,
      "tool": "aayudha",
      "version": "-",
      "detail": "skipped: [verify] dast is off"
    },
    {
      "floor": "api",
      "result": "skipped",
      "value": 0,
      "threshold": 0,
      "tool": "aayudha",
      "version": "-",
      "detail": "skipped: no k6 script ([verify.floors.api] script)"
    },
    {
      "floor": "mobile",
      "result": "skipped",
      "value": 0,
      "threshold": 0,
      "tool": "aayudha",
      "version": "-",
      "detail": "skipped: no ios or android in [verify] platforms"
    }
  ],
  "cost": {
    "tokens_in": 0,
    "tokens_out": 0,
    "usd": 0
  },
  "links": {
    "issue": "rahulnakmol/agentic-ayudha#173",
    "pr": "rahulnakmol/agentic-ayudha#179",
    "ready_snapshot": "specs/173/ready.md"
  },
  "created_at": "2026-10-15T07:30:19Z"
}
